,id,poster_path,adult,overview,release_date,genre_ids,original_title,original_language,title,backdrop_path,popularity,vote_count,video,vote_average,media_type,poster_path_drop,adult_drop,overview_drop,release_date_drop,genre_ids_drop,original_title_drop,original_language_drop,title_drop,backdrop_path_drop,popularity_drop,vote_count_drop,video_drop,vote_average_drop,media_type_drop
547,347392,/bznkSqWqj43DhzHrbLehsr6ncb0.jpg,False,"Un repartidor de pizza es asesinado mientras trabaja y la ciudad comienza a buscar un responsable. Entre la lista de posibles candidatos figura un fantasma, un traficante de drogas e incluso un hombre-lobo caído en desgracia.",2018-09-10,"[35, 27]",Slice,en,Slice,/8SC2WGdfKUtSC759uPHeTIKF7s0.jpg,5.881,85,False,4.5,movie,/bznkSqWqj43DhzHrbLehsr6ncb0.jpg,False,"Un repartidor de pizza es asesinado mientras trabaja y la ciudad comienza a buscar un responsable. Entre la lista de posibles candidatos figura un fantasma, un traficante de drogas e incluso un hombre-lobo caído en desgracia.",2018-09-10,"[35, 27]",Slice,en,Slice,/8SC2WGdfKUtSC759uPHeTIKF7s0.jpg,5.881,85,False,4.5,movie
548,583984,/lZO1tZCnTNcnRWNIXr4dCjQlQb3.jpg,False,Los hermanos Nate y Angela Harmon y sus amigos deben enfrentarse a los zombis de los presidentes estadounidenses el 4 de julio. Pero para Nate y Angela hay algo aún más aterrador acechando en el bosque ... la perspectiva de pasar una noche entera juntos.,2020-07-04,"[27, 35]",Re-Elected,en,Re-Elected,/n5zliNGIDyG1k0IkUo3o4XUJFgI.jpg,7.661,80,False,7.0,movie,/lZO1tZCnTNcnRWNIXr4dCjQlQb3.jpg,False,Los hermanos Nate y Angela Harmon y sus amigos deben enfrentarse a los zombis de los presidentes estadounidenses el 4 de julio. Pero para Nate y Angela hay algo aún más aterrador acechando en el bosque ... la perspectiva de pasar una noche entera juntos.,2020-07-04,"[27, 35]",Re-Elected,en,Re-Elected,/n5zliNGIDyG1k0IkUo3o4XUJFgI.jpg,7.661,80,False,7.0,movie
549,14005,/gnASuHPWrVwpQdKeyaMspgGCePC.jpg,False,"Los miembros de una compañía de cine independiente están trabajando en una nueva película de bajo presupuesto, que cuenta con efectos especiales y de maquillaje, sangre y sexo fácil. Pero la diversión y las bromas en el plató se van conviertiendo en tragedia, poco a poco. Una explosiva y misteriosa mujer está sembrando el pánico con sus sangrientos asesinatos. Larry, el invidente director de la película, intenta que ni siquiera este inconveniente afecte al curso del rodaje. Mientras, la inocente Jennifer mantiene un triángulo amoroso con dos de los miembros del grupo, Casey y Jerry.",1999-10-29,"[27, 35, 14, 53]",Terror Firmer,en,Terror Firmer,/z3b7Sa90iEg0wlObfDiADVotY1a.jpg,4.586,84,False,6.1,movie,/gnASuHPWrVwpQdKeyaMspgGCePC.jpg,False,"Los miembros de una compañía de cine independiente están trabajando en una nueva película de bajo presupuesto, que cuenta con efectos especiales y de maquillaje, sangre y sexo fácil. Pero la diversión y las bromas en el plató se van conviertiendo en tragedia, poco a poco. Una explosiva y misteriosa mujer está sembrando el pánico con sus sangrientos asesinatos. Larry, el invidente director de la película, intenta que ni siquiera este inconveniente afecte al curso del rodaje. Mientras, la inocente Jennifer mantiene un triángulo amoroso con dos de los miembros del grupo, Casey y Jerry.",1999-10-29,"[27, 35, 14, 53]",Terror Firmer,en,Terror Firmer,/z3b7Sa90iEg0wlObfDiADVotY1a.jpg,4.586,84,False,6.1,movie
550,31245,/2IabqewicBpxM8cmVknRhCEvrWE.jpg,False,"McCreedy, un anciano vigilante nocturno de un gran estudio de cine, advierte a Kevin, muchacho impulsivo, de que se mantenga alejado de cierto cuarto en el sótano. La curiosidad de Kevin le hace no atender este consejo e investiga el porqué. Penetra y se encuentra a los terribles Hobgoblins, criaturas traviesas que se mueven siguiendo impulsos de luz y que se apoderan de las fantasías de la gente. Sólo reviven de noche y, tras huir, han de ser capturados antes del amanecer o la ciudad correrá peligro. Kevin corre a buscar ayuda de sus amigos.",1988-07-14,"[27, 35, 878]",Hobgoblins,en,Hobgoblins,/xVRFR46X0asgsSCW3y0lQcrGmBx.jpg,5.172,87,False,2.7,movie,/2IabqewicBpxM8cmVknRhCEvrWE.jpg,False,"McCreedy, un anciano vigilante nocturno de un gran estudio de cine, advierte a Kevin, muchacho impulsivo, de que se mantenga alejado de cierto cuarto en el sótano. La curiosidad de Kevin le hace no atender este consejo e investiga el porqué. Penetra y se encuentra a los terribles Hobgoblins, criaturas traviesas que se mueven siguiendo impulsos de luz y que se apoderan de las fantasías de la gente. Sólo reviven de noche y, tras huir, han de ser capturados antes del amanecer o la ciudad correrá peligro. Kevin corre a buscar ayuda de sus amigos.",1988-07-14,"[27, 35, 878]",Hobgoblins,en,Hobgoblins,/xVRFR46X0asgsSCW3y0lQcrGmBx.jpg,5.172,87,False,2.7,movie
551,53150,/mDA0Fvv2Z6XCg64HvE3Vmhyw2I5.jpg,False,"Unos adolescentes roban un cadáver, desconociendo que perteneció a un zombie caníbal que puede transmitir su patología a cualquiera a quien muerda.",1989-05-05,"[27, 35, 878]",C.H.U.D. II: Bud the Chud,en,C.H.U.D. 2 - Reacción viva,/dr3A6z08VaW9QOgwY0zZEqEUWgt.jpg,4.361,60,False,4.4,movie,/mDA0Fvv2Z6XCg64HvE3Vmhyw2I5.jpg,False,"Unos adolescentes roban un cadáver, desconociendo que perteneció a un zombie caníbal que puede transmitir su patología a cualquiera a quien muerda.",1989-05-05,"[27, 35, 878]",C.H.U.D. II: Bud the Chud,en,C.H.U.D. 2 - Reacción viva,/dr3A6z08VaW9QOgwY0zZEqEUWgt.jpg,4.361,60,False,4.4,movie
552,39923,/eeMUixPTTuNICbmNHn3XqBPnR1e.jpg,False,"Una pareja de turistas americanos son brutalmente asesinados durante una romántica acampada. Unos días después, un grupo de universitarios llegan a ese campamento con la intención de aprender sobre los druidas y otras leyendas celtas, pero no saben que en el bosque habitan desde hace mucho los descendientes de un clan de caníbales. (FILMAFFINITY)",2006-01-10,"[27, 35]",Evil Breed: The Legend of Samhain,en,Evil Breed: La Leyenda de Samhain,/4Yn8JnFi46VYdVoLxiBfXMMCLG1.jpg,4.071,17,False,5.0,movie,/eeMUixPTTuNICbmNHn3XqBPnR1e.jpg,False,"Una pareja de turistas americanos son brutalmente asesinados durante una romántica acampada. Unos días después, un grupo de universitarios llegan a ese campamento con la intención de aprender sobre los druidas y otras leyendas celtas, pero no saben que en el bosque habitan desde hace mucho los descendientes de un clan de caníbales. (FILMAFFINITY)",2006-01-10,"[27, 35]",Evil Breed: The Legend of Samhain,en,Evil Breed: La Leyenda de Samhain,/4Yn8JnFi46VYdVoLxiBfXMMCLG1.jpg,4.071,17,False,5.0,movie
553,1112284,/3M85AzjWaX4NYfJsJjpUW0IfTKa.jpg,False,,2023-04-24,"[35, 27]",The Ring,en,The Ring,/lQUfHzMhHX01cQI69WvodojT8UK.jpg,5.25,0,False,0.0,movie,/3M85AzjWaX4NYfJsJjpUW0IfTKa.jpg,False,,2023-04-24,"[35, 27]",The Ring,en,The Ring,/lQUfHzMhHX01cQI69WvodojT8UK.jpg,5.25,0,False,0.0,movie
554,704630,/3rxKic2PDrheSXMCG82vm9LAm8e.jpg,False,"Brandon se prepara para dar su último show de stand-up. A medida que transcurren sus historias y chistes, el público comienza a animarse. Pero en ese preciso momento, él se dará cuenta de que esas historias tienen una fuerte relación con su pasado. Más de lo que él se imagina…",2020-11-17,"[35, 27, 878]",Asylum: Twisted Horror & Fantasy Tales,en,Asylum: Twisted Horror & Fantasy Tales,/lenWA6m7LQqviAwrv1bl48q4QuN.jpg,5.387,27,False,6.1,movie,/3rxKic2PDrheSXMCG82vm9LAm8e.jpg,False,"Brandon se prepara para dar su último show de stand-up. A medida que transcurren sus historias y chistes, el público comienza a animarse. Pero en ese preciso momento, él se dará cuenta de que esas historias tienen una fuerte relación con su pasado. Más de lo que él se imagina…",2020-11-17,"[35, 27, 878]",Asylum: Twisted Horror & Fantasy Tales,en,Asylum: Twisted Horror & Fantasy Tales,/lenWA6m7LQqviAwrv1bl48q4QuN.jpg,5.387,27,False,6.1,movie
555,273060,/7volDaBhxx7tW4zz8sOfDmODNjB.jpg,False,,2012-05-22,"[27, 35]",The Evil Dead Inbred Rednecks,en,The Evil Dead Inbred Rednecks,/4fM3nIMcWssaL8pEPcWB0h0MtQb.jpg,5.212,5,False,3.4,movie,/7volDaBhxx7tW4zz8sOfDmODNjB.jpg,False,,2012-05-22,"[27, 35]",The Evil Dead Inbred Rednecks,en,The Evil Dead Inbred Rednecks,/4fM3nIMcWssaL8pEPcWB0h0MtQb.jpg,5.212,5,False,3.4,movie
556,77022,/hiGHNP86sz4otnFIQxRC2ADjUmv.jpg,False,"The haunted house, (estrenado en 1929) fue el segundo cortometraje sonoro de dibujos animados, el protagonista de esta película fue el pequeño Mickey Mouse. Fue escrito y dirigido por Walt Disney y Ub Iwerks.  En este cortometraje Mickey Mouse tendrá la fortuna de encontrar cobijo en una casa durante una tempestad. Una casa encantada habitada por misteriosos personajes que desencadenarán un sinfín de situaciones divertidas.",1929-12-02,"[16, 35, 10751, 27, 10402]",The Haunted House,en,Mickey Mouse: La casa encantada,/8qyxI3CYbckwi8ABRIgUhdWPgyT.jpg,6.907,70,False,6.7,movie,/hiGHNP86sz4otnFIQxRC2ADjUmv.jpg,False,"The haunted house, (estrenado en 1929) fue el segundo cortometraje sonoro de dibujos animados, el protagonista de esta película fue el pequeño Mickey Mouse. Fue escrito y dirigido por Walt Disney y Ub Iwerks.  En este cortometraje Mickey Mouse tendrá la fortuna de encontrar cobijo en una casa durante una tempestad. Una casa encantada habitada por misteriosos personajes que desencadenarán un sinfín de situaciones divertidas.",1929-12-02,"[16, 35, 10751, 27, 10402]",The Haunted House,en,Mickey Mouse: La casa encantada,/8qyxI3CYbckwi8ABRIgUhdWPgyT.jpg,6.907,70,False,6.7,movie
557,44250,/nwJnkCghNpjnJ6GkSDg5YYooGV4.jpg,False,,2005-10-13,"[53, 27, 35]",Cruel World,en,Cruel World,/qtihr9KQmnFGv43O4hkkK0pWAHj.jpg,4.065,17,False,4.5,movie,/nwJnkCghNpjnJ6GkSDg5YYooGV4.jpg,False,,2005-10-13,"[53, 27, 35]",Cruel World,en,Cruel World,/qtihr9KQmnFGv43O4hkkK0pWAHj.jpg,4.065,17,False,4.5,movie
558,26230,/bYbLg6xgdPQqKDCXfc0dlJVwkRZ.jpg,False,"Nukemama Corporation reabre sus instalaciones y construye una nueva universidad. Allí los experimentos de la profesara Hold con el genoma humano dan lugar a la creación de los subhumanoides, una raza mutante al servicio del hombre, pero el experimento no sale tan bien como lo esperado.",1991-03-29,"[35, 27, 878]",Class of Nuke 'Em High 2: Subhumanoid Meltdown,en,Mutantes en la universidad 2,/eu8UIOZTuDES70resp759TTqOAY.jpg,4.521,49,False,4.5,movie,/bYbLg6xgdPQqKDCXfc0dlJVwkRZ.jpg,False,"Nukemama Corporation reabre sus instalaciones y construye una nueva universidad. Allí los experimentos de la profesara Hold con el genoma humano dan lugar a la creación de los subhumanoides, una raza mutante al servicio del hombre, pero el experimento no sale tan bien como lo esperado.",1991-03-29,"[35, 27, 878]",Class of Nuke 'Em High 2: Subhumanoid Meltdown,en,Mutantes en la universidad 2,/eu8UIOZTuDES70resp759TTqOAY.jpg,4.521,49,False,4.5,movie
559,21151,/38TFPS4rZ5qvD2pPOKgcwWAv6fc.jpg,False,"Jeremy Capello es un estudiante cuya única preocupación es conseguir novia. Tras ser seducido por una atractiva compañera y ser mordido por ella, se transforma en vampiro.  Lejos de preocuparse, decide sacarle partido a sus recién adquiridos poderes.",1987-10-01,"[35, 10751, 27]",My Best Friend Is a Vampire,en,El vampiro adolescente,/t1tvkqhdsZwkF3qQ5EF6ilD5T8P.jpg,5.05,75,False,5.9,movie,/38TFPS4rZ5qvD2pPOKgcwWAv6fc.jpg,False,"Jeremy Capello es un estudiante cuya única preocupación es conseguir novia. Tras ser seducido por una atractiva compañera y ser mordido por ella, se transforma en vampiro.  Lejos de preocuparse, decide sacarle partido a sus recién adquiridos poderes.",1987-10-01,"[35, 10751, 27]",My Best Friend Is a Vampire,en,El vampiro adolescente,/t1tvkqhdsZwkF3qQ5EF6ilD5T8P.jpg,5.05,75,False,5.9,movie
560,468332,/ajGQowd8zESMGurHCk2ukNTWngx.jpg,False,"Los tiburones atacan un rodeo de peces en el río Mississippi, y depende de un grupo de lugareños el detenerlos.",2017-07-31,"[35, 27, 53]",Mississippi River Sharks,en,Mississippi River Sharks,/fBDj1cYFKbTkcGipbH7ZAEA10Bm.jpg,4.195,13,False,5.3,movie,/ajGQowd8zESMGurHCk2ukNTWngx.jpg,False,"Los tiburones atacan un rodeo de peces en el río Mississippi, y depende de un grupo de lugareños el detenerlos.",2017-07-31,"[35, 27, 53]",Mississippi River Sharks,en,Mississippi River Sharks,/fBDj1cYFKbTkcGipbH7ZAEA10Bm.jpg,4.195,13,False,5.3,movie
561,3023,/spZzSuujqiYHMK5pIvJOS5LDYD0.jpg,False,Abbott y Costello se meten en la piel de un par de policías norteamericanos que viajan a Londres para aprender nuevas técnicas de sus compañeros ingleses. Allí conocen al rarito Dr. Jekyll y por error uno de ellos acaba inyectándose con una extraña jeringa que hace que el médico se convierta en un siniestro personaje.,1953-08-01,"[35, 27, 878]",Abbott and Costello Meet Dr. Jekyll and Mr. Hyde,en,Abbott y Costello contra el Dr. Jekyll y Mr. Hyde,/aM81XfMvYyb1Qpig5rp8tOodRjt.jpg,4.688,63,False,6.5,movie,/spZzSuujqiYHMK5pIvJOS5LDYD0.jpg,False,Abbott y Costello se meten en la piel de un par de policías norteamericanos que viajan a Londres para aprender nuevas técnicas de sus compañeros ingleses. Allí conocen al rarito Dr. Jekyll y por error uno de ellos acaba inyectándose con una extraña jeringa que hace que el médico se convierta en un siniestro personaje.,1953-08-01,"[35, 27, 878]",Abbott and Costello Meet Dr. Jekyll and Mr. Hyde,en,Abbott y Costello contra el Dr. Jekyll y Mr. Hyde,/aM81XfMvYyb1Qpig5rp8tOodRjt.jpg,4.688,63,False,6.5,movie
562,40446,/rhcTvedkhwTMmXT0ao2Y31Ll9WM.jpg,False,,1990-10-05,"[35, 27, 53]",Sorority House Massacre II,en,Sorority House Massacre II,/zcKUQRei2VUQY6lwsEschGZ7PsP.jpg,3.387,53,False,5.7,movie,/rhcTvedkhwTMmXT0ao2Y31Ll9WM.jpg,False,,1990-10-05,"[35, 27, 53]",Sorority House Massacre II,en,Sorority House Massacre II,/zcKUQRei2VUQY6lwsEschGZ7PsP.jpg,3.387,53,False,5.7,movie
563,48463,/hsBmbcL4KiZerEwFJO4BHlvnbA8.jpg,False,,2004-12-17,"[35, 12, 27]",Incident at Loch Ness,en,Incident at Loch Ness,/2yOQlNiVanHwBEbTaIzf5oOI60L.jpg,6.266,74,False,5.8,movie,/hsBmbcL4KiZerEwFJO4BHlvnbA8.jpg,False,,2004-12-17,"[35, 12, 27]",Incident at Loch Ness,en,Incident at Loch Ness,/2yOQlNiVanHwBEbTaIzf5oOI60L.jpg,6.266,74,False,5.8,movie
564,12718,/ls5i23WxC8ojS7Xg9hTMe3DmBnC.jpg,False,"En un futuro postapocalíptico, la humanidad vive de nuevo de forma prehistórica. David es miembro de una tribu que habita en una caverna. Es un joven rebelde, y le desesperan las leyes tan represivas que la tribu impone. Para salvar a su novia se ve obligado a matar a su padre, el jefe de la tribu, por lo que es desterrado junto con cinco de sus amigos. Una vez fuera de la caverna, descubren que el territorio ignoto y peligroso del ""viejo mundo"" con el que tanto habían soñado ha evolucionado sin ellos y se ha convertido en un mundo complejo, tan atractivo como aterrador...",2002-04-03,"[35, 27, 878]",Teenage Caveman,en,El regreso a las cavernas,/8M0AUVduBXdennlgXNNjkPyunhI.jpg,4.923,46,False,3.6,movie,/ls5i23WxC8ojS7Xg9hTMe3DmBnC.jpg,False,"En un futuro postapocalíptico, la humanidad vive de nuevo de forma prehistórica. David es miembro de una tribu que habita en una caverna. Es un joven rebelde, y le desesperan las leyes tan represivas que la tribu impone. Para salvar a su novia se ve obligado a matar a su padre, el jefe de la tribu, por lo que es desterrado junto con cinco de sus amigos. Una vez fuera de la caverna, descubren que el territorio ignoto y peligroso del ""viejo mundo"" con el que tanto habían soñado ha evolucionado sin ellos y se ha convertido en un mundo complejo, tan atractivo como aterrador...",2002-04-03,"[35, 27, 878]",Teenage Caveman,en,El regreso a las cavernas,/8M0AUVduBXdennlgXNNjkPyunhI.jpg,4.923,46,False,3.6,movie
565,323792,/rwXmbnXIQcfmdK0phXcMIZgX0KA.jpg,False,"Un sádico, apodado ""L.A. Slasher"" ve el momento perfecto para comenzar a perseguir, secuestrar y torturar a las mujeres en un manicomio abandonado. Tras el secuestro, la tortura y el asesinato, sube los videos a las redes sociales más populares, como YouTube y Twitter. Esto lleva a la policía a creer que ""L.A. Slasher"" no está matando solo por diversión, sino para ser famoso.",2015-06-12,"[35, 80, 27]",L.A. Slasher,en,L.A. Slasher,/aG2ScF2ISK2JWYJogvfWo7mZJvT.jpg,6.376,36,False,5.1,movie,/rwXmbnXIQcfmdK0phXcMIZgX0KA.jpg,False,"Un sádico, apodado ""L.A. Slasher"" ve el momento perfecto para comenzar a perseguir, secuestrar y torturar a las mujeres en un manicomio abandonado. Tras el secuestro, la tortura y el asesinato, sube los videos a las redes sociales más populares, como YouTube y Twitter. Esto lleva a la policía a creer que ""L.A. Slasher"" no está matando solo por diversión, sino para ser famoso.",2015-06-12,"[35, 80, 27]",L.A. Slasher,en,L.A. Slasher,/aG2ScF2ISK2JWYJogvfWo7mZJvT.jpg,6.376,36,False,5.1,movie
566,13383,/go1lGUq9KTQPvNvk7AgyaZFASCx.jpg,False,"Vísperas de Navidad. En su palacio celestial, Santa Claus se prepara para llevar amor y esperanzas a los niños del mundo. Y en el Infierno, Satanás envía a la tierra (una vez más) al “diablo menor” Precio, con la orden de tratar de sabotear (esta vez sí) la Nochebuena. En México, un grupo de niños se convertirá en blanco de la anual lucha entre Santa y Precio: un trío de chiquillos malcriados, un infeliz “niño rico” y una humilde niña. Es así que comienza una alucinante lucha entre el Bien y el Mal, donde estará en juego el significado la festividad de navidad y Noche Buena.",1960-10-01,"[10751, 14, 27, 35]",Santa Claus,es,Santa Claus,/eQQ0JokxpSbEN0QDeeishIYYM5k.jpg,6.197,97,False,5.7,movie,/go1lGUq9KTQPvNvk7AgyaZFASCx.jpg,False,"Vísperas de Navidad. En su palacio celestial, Santa Claus se prepara para llevar amor y esperanzas a los niños del mundo. Y en el Infierno, Satanás envía a la tierra (una vez más) al “diablo menor” Precio, con la orden de tratar de sabotear (esta vez sí) la Nochebuena. En México, un grupo de niños se convertirá en blanco de la anual lucha entre Santa y Precio: un trío de chiquillos malcriados, un infeliz “niño rico” y una humilde niña. Es así que comienza una alucinante lucha entre el Bien y el Mal, donde estará en juego el significado la festividad de navidad y Noche Buena.",1960-10-01,"[10751, 14, 27, 35]",Santa Claus,es,Santa Claus,/eQQ0JokxpSbEN0QDeeishIYYM5k.jpg,6.197,97,False,5.7,movie
567,24133,/xXDmkwuWyQTjD8Tz7dJr93z9KdU.jpg,False,,2008-11-11,"[35, 27, 878]",One-Eyed Monster,en,One-Eyed Monster,,6.817,51,False,4.5,movie,/xXDmkwuWyQTjD8Tz7dJr93z9KdU.jpg,False,,2008-11-11,"[35, 27, 878]",One-Eyed Monster,en,One-Eyed Monster,,6.817,51,False,4.5,movie
568,1008392,/uFKgVpPozKjAA5IMA4A2qUd8QOH.jpg,False,,2023-06-16,"[27, 35]",The Blackening,en,The Blackening,/wuwMLVIY0Zqfz6uToyDmb7TYRVN.jpg,6.871,0,False,0.0,movie,/uFKgVpPozKjAA5IMA4A2qUd8QOH.jpg,False,,2023-06-16,"[27, 35]",The Blackening,en,The Blackening,/wuwMLVIY0Zqfz6uToyDmb7TYRVN.jpg,6.871,0,False,0.0,movie
569,24632,/kdKEBV3MNMvZv4jVAXFUYiOXXar.jpg,False,El doctor Hunter (Billy Zane) organiza un fin de semana campestre con la intención de que su hja adolescente conozca a su nueva pareja... Lo que debia ser un retiro tranquilo se convierte en pesadilla al ser atacados por zombies infectados por comer carne contaminada. (FILMAFFINITY),2007-05-22,"[27, 35, 53]",The Mad,en,Mis apetitosos vecinos,/oXwyU1RQEhF2e5fncI16hj0QMof.jpg,4.166,46,False,5.7,movie,/kdKEBV3MNMvZv4jVAXFUYiOXXar.jpg,False,El doctor Hunter (Billy Zane) organiza un fin de semana campestre con la intención de que su hja adolescente conozca a su nueva pareja... Lo que debia ser un retiro tranquilo se convierte en pesadilla al ser atacados por zombies infectados por comer carne contaminada. (FILMAFFINITY),2007-05-22,"[27, 35, 53]",The Mad,en,Mis apetitosos vecinos,/oXwyU1RQEhF2e5fncI16hj0QMof.jpg,4.166,46,False,5.7,movie
570,554762,/dlmjLTvDIQyaukEnEQvu7cxvfc2.jpg,False,,2018-10-17,"[35, 27]",Death to Metal,en,Death to Metal,/dHBiSdhzw3iG2jYZhSsxQbYjCtJ.jpg,4.85,2,False,7.5,movie,/dlmjLTvDIQyaukEnEQvu7cxvfc2.jpg,False,,2018-10-17,"[35, 27]",Death to Metal,en,Death to Metal,/dHBiSdhzw3iG2jYZhSsxQbYjCtJ.jpg,4.85,2,False,7.5,movie
571,285598,/fVDbQ362FPVq5B8t8XzVzGd55hW.jpg,False,,2014-05-08,"[35, 27]",Call Girl of Cthulhu,en,Call Girl of Cthulhu,/9l1qL7iXIELIqIxOojGfsHkW1sX.jpg,3.282,25,False,5.6,movie,/fVDbQ362FPVq5B8t8XzVzGd55hW.jpg,False,,2014-05-08,"[35, 27]",Call Girl of Cthulhu,en,Call Girl of Cthulhu,/9l1qL7iXIELIqIxOojGfsHkW1sX.jpg,3.282,25,False,5.6,movie
572,838719,/losAMed89IHUslZwCiIXCQqjAp3.jpg,False,,2021-10-01,"[27, 35]",Val,en,Val,/pVef6ZyUIbccQ1s51IvTM1AjfIQ.jpg,4.228,14,False,5.6,movie,/losAMed89IHUslZwCiIXCQqjAp3.jpg,False,,2021-10-01,"[27, 35]",Val,en,Val,/pVef6ZyUIbccQ1s51IvTM1AjfIQ.jpg,4.228,14,False,5.6,movie
573,28848,/piR3vg5DU61dGnjNbKpXN0d4JRd.jpg,False,"Un peligroso psicópata lleva una doble vida como gigoló. Gracias a esta tapadera, se cita con mujeres de mediana edad, a las que mata, roba sus posesiones y joyas, descuartiza y devora sus restos.",2005-06-14,"[27, 35]",Quando Alice ruppe lo specchio,it,La sombra de Lester,/x9mZzzbFhBoOEz58tAUqVqG2aoX.jpg,5.374,70,False,5.5,movie,/piR3vg5DU61dGnjNbKpXN0d4JRd.jpg,False,"Un peligroso psicópata lleva una doble vida como gigoló. Gracias a esta tapadera, se cita con mujeres de mediana edad, a las que mata, roba sus posesiones y joyas, descuartiza y devora sus restos.",2005-06-14,"[27, 35]",Quando Alice ruppe lo specchio,it,La sombra de Lester,/x9mZzzbFhBoOEz58tAUqVqG2aoX.jpg,5.374,70,False,5.5,movie
574,16846,/foyZxQ68TaUegMxtLnI7JR0q3E7.jpg,False,,2008-07-04,"[35, 27, 14]",Gingerdead Man 2: Passion of the Crust,en,Gingerdead Man 2: Passion of the Crust,/RWN6gQKphxDgzQKSqw4qda7tb9.jpg,4.164,38,False,5.4,movie,/foyZxQ68TaUegMxtLnI7JR0q3E7.jpg,False,,2008-07-04,"[35, 27, 14]",Gingerdead Man 2: Passion of the Crust,en,Gingerdead Man 2: Passion of the Crust,/RWN6gQKphxDgzQKSqw4qda7tb9.jpg,4.164,38,False,5.4,movie
575,384450,/9Lbr89rVnLHfp8zXVKiuM4gia3V.jpg,False,Una película post-apocaliptica del salvaje oeste que narra la historia de un grupo de pistoleros que tratan de limpiar un pequeño pueblo de una plaga de zombies,2016-04-01,"[35, 27, 37]",Dead 7,en,Dead 7,/v2eeTmdRGJGU6sGfoAHHEBRwMCd.jpg,4.246,49,False,4.4,movie,/9Lbr89rVnLHfp8zXVKiuM4gia3V.jpg,False,Una película post-apocaliptica del salvaje oeste que narra la historia de un grupo de pistoleros que tratan de limpiar un pequeño pueblo de una plaga de zombies,2016-04-01,"[35, 27, 37]",Dead 7,en,Dead 7,/v2eeTmdRGJGU6sGfoAHHEBRwMCd.jpg,4.246,49,False,4.4,movie
576,565373,/45AhARdSylYfml2Vkq2UFuafXty.jpg,False,"Tras el fallecimiento de su hija Maja en su octavo cumpleaños, Elin y Tobias se dirigen a un camping en su honor. Con la idea de su muerte aún pesándoles en la conciencia, se ven envueltos en un espiral de tormento, humillación y pesadillas a manos de una compañía de excéntricos perturbados.",2019-11-15,"[27, 35, 14]",Koko-di Koko-da,sv,Koko-di Koko-da,/dxe4F1ZOiwNNIiHBZNhgOZ2jNhJ.jpg,3.562,51,False,5.9,movie,/45AhARdSylYfml2Vkq2UFuafXty.jpg,False,"Tras el fallecimiento de su hija Maja en su octavo cumpleaños, Elin y Tobias se dirigen a un camping en su honor. Con la idea de su muerte aún pesándoles en la conciencia, se ven envueltos en un espiral de tormento, humillación y pesadillas a manos de una compañía de excéntricos perturbados.",2019-11-15,"[27, 35, 14]",Koko-di Koko-da,sv,Koko-di Koko-da,/dxe4F1ZOiwNNIiHBZNhgOZ2jNhJ.jpg,3.562,51,False,5.9,movie
577,76804,/hO2dNeaBlSLnhZR14zljMrQ0JGs.jpg,False,,1927-09-09,"[27, 35, 9648]",The Cat and the Canary,en,El Legado Tenebroso,/4u8XR1ULW6c31l7QRgDZOsrUSra.jpg,3.2,56,False,6.8,movie,/hO2dNeaBlSLnhZR14zljMrQ0JGs.jpg,False,,1927-09-09,"[27, 35, 9648]",The Cat and the Canary,en,El Legado Tenebroso,/4u8XR1ULW6c31l7QRgDZOsrUSra.jpg,3.2,56,False,6.8,movie
578,27880,/jn25dGdIc9gQ1Lm4WV4lhAjx1Ph.jpg,False,,2008-02-18,"[27, 35, 28]",最強兵器女子高生　ＲＩＫＡ,ja,Zombie Hunter Rika,/glemXbT6WdqlznYtdY0L1If5XRa.jpg,3.91,13,False,4.5,movie,/jn25dGdIc9gQ1Lm4WV4lhAjx1Ph.jpg,False,,2008-02-18,"[27, 35, 28]",最強兵器女子高生　ＲＩＫＡ,ja,Zombie Hunter Rika,/glemXbT6WdqlznYtdY0L1If5XRa.jpg,3.91,13,False,4.5,movie
579,40034,/7abxcsMWnkvovtP20P9FHCIS7Se.jpg,False,"Eric Binford sufrió las burlas de todos quienes le rodeaban. Amante del cine, se sumerge en los sueños y fantasías de los personajes y estrellas de las películas. Pero su mente perturbada por tanta humillación, le hace cometer crímenes inspirados todos ellos en personajes de sus amadas películas...",1980-10-14,"[18, 27, 53, 35]",Fade to Black,en,Fundido a negro,/xd6LOC4ISjM95ETniBOp3YKlbos.jpg,3.507,58,False,5.6,movie,/7abxcsMWnkvovtP20P9FHCIS7Se.jpg,False,"Eric Binford sufrió las burlas de todos quienes le rodeaban. Amante del cine, se sumerge en los sueños y fantasías de los personajes y estrellas de las películas. Pero su mente perturbada por tanta humillación, le hace cometer crímenes inspirados todos ellos en personajes de sus amadas películas...",1980-10-14,"[18, 27, 53, 35]",Fade to Black,en,Fundido a negro,/xd6LOC4ISjM95ETniBOp3YKlbos.jpg,3.507,58,False,5.6,movie
580,680631,/5DAmmAxTeZd2oh6cveD0yyysjcT.jpg,False,"Un grupo de robustos trabajadores, liderados por un padre y un hijo enemistados, deben sobrevivir una noche tras despertar accidentalmente a un vampiro irlandés.",2020-04-20,"[27, 35]",Boys from County Hell,en,Boys from County Hell,/1VOXM9E6Cdu98sAanLb6TyCns1L.jpg,6.543,25,False,5.5,movie,/5DAmmAxTeZd2oh6cveD0yyysjcT.jpg,False,"Un grupo de robustos trabajadores, liderados por un padre y un hijo enemistados, deben sobrevivir una noche tras despertar accidentalmente a un vampiro irlandés.",2020-04-20,"[27, 35]",Boys from County Hell,en,Boys from County Hell,/1VOXM9E6Cdu98sAanLb6TyCns1L.jpg,6.543,25,False,5.5,movie
