,id,poster_path,adult,overview,release_date,genre_ids,original_title,original_language,title,backdrop_path,popularity,vote_count,video,vote_average,media_type,poster_path_drop,adult_drop,overview_drop,release_date_drop,genre_ids_drop,original_title_drop,original_language_drop,title_drop,backdrop_path_drop,popularity_drop,vote_count_drop,video_drop,vote_average_drop,media_type_drop
157,664574,/cfHTSUxJjnmjkyEvW7ot2OikGAD.jpg,False,"Mientras el mundo se enfrenta al apocalipsis, un grupo de viejos amigos se reúne para celebrar la Navidad en una idílica casa de campo en Reino Unido. Incomodados por la idea de la inevitable destrucción de la humanidad, deciden afrontar la situación con tranquilidad, abriendo otra botella de Prosecco y continuando con la celebración… Pero, por mucho que quieran fingir normalidad, tarde o temprano, tendrán que hacer frente a la idea de que es su última noche.",2021-12-03,"[35, 878, 27]",Silent Night,en,La última noche,/nJYAAOk74VjPlwz34jWFh8MPw2r.jpg,18.917,349,False,6.1,movie,/cfHTSUxJjnmjkyEvW7ot2OikGAD.jpg,False,"Mientras el mundo se enfrenta al apocalipsis, un grupo de viejos amigos se reúne para celebrar la Navidad en una idílica casa de campo en Reino Unido. Incomodados por la idea de la inevitable destrucción de la humanidad, deciden afrontar la situación con tranquilidad, abriendo otra botella de Prosecco y continuando con la celebración… Pero, por mucho que quieran fingir normalidad, tarde o temprano, tendrán que hacer frente a la idea de que es su última noche.",2021-12-03,"[35, 878, 27]",Silent Night,en,La última noche,/nJYAAOk74VjPlwz34jWFh8MPw2r.jpg,18.917,349,False,6.1,movie
158,218784,/fblh9Q2AkYHQNgw1d9z9O45tbFr.jpg,False,"En Dillford (Ohio) hace tres días todo estaba tranquilo y se mantenía el estatus de siempre: los vampiros estaban en la parte superior del orden social, los zombis eran en la parte inferior, y los seres humanos se quedaban en el medio. Pero este delicado equilibrio se ve destrozado cuando el apocalipsis alienígena llega a Dillford y pone fin a toda la armonía. Ahora es el humano contra vampiros contra zombies, y todos ellos están en contra de los alienígenas. Corresponde a tres adolescentes —un humano, un vampiro y un zombie— que hacen equipo, y deben encontrar la manera de deshacerse de los visitantes interplanetarios, y tratar de restablecer el orden en esta pequeña ciudad “normal”.",2015-10-30,"[878, 35, 27]",Freaks of Nature,en,Éramos pocos y llegaron los aliens,/frTXhzfhoVPVwPJKJx40svhmPeW.jpg,12.821,480,False,6.2,movie,/fblh9Q2AkYHQNgw1d9z9O45tbFr.jpg,False,"En Dillford (Ohio) hace tres días todo estaba tranquilo y se mantenía el estatus de siempre: los vampiros estaban en la parte superior del orden social, los zombis eran en la parte inferior, y los seres humanos se quedaban en el medio. Pero este delicado equilibrio se ve destrozado cuando el apocalipsis alienígena llega a Dillford y pone fin a toda la armonía. Ahora es el humano contra vampiros contra zombies, y todos ellos están en contra de los alienígenas. Corresponde a tres adolescentes —un humano, un vampiro y un zombie— que hacen equipo, y deben encontrar la manera de deshacerse de los visitantes interplanetarios, y tratar de restablecer el orden en esta pequeña ciudad “normal”.",2015-10-30,"[878, 35, 27]",Freaks of Nature,en,Éramos pocos y llegaron los aliens,/frTXhzfhoVPVwPJKJx40svhmPeW.jpg,12.821,480,False,6.2,movie
159,21588,/ouqIPlczOt2fpr9KkJ5EndSnSQp.jpg,False,"Francesco Dellamorte es el cuidador del cementerio de Buffalora, un pueblo del norte de Italia. Dellamorte vive una vida solitaria apartado del mundo; su único amigo es Gnaghi, un pequeño, feo, lisiado y mudo compañero con el que comparte su ronda diaria por el cementerio. Desde hace algún tiempo, los muertos enterrados en el cementerio de Buffalora reviven debido a una súbita y misteriosa epidemia. Dellamorte tendrá que impedir que los muertos invadan el mundo de los vivos, algo que el resto de los humanos piensa que es sólo parte de su imaginación.",1996-04-26,"[27, 14, 35, 18]",DellaMorte DellAmore,it,Mi novia es un zombie,/hEhOPX1NCke6ky7930NqNXZYuu1.jpg,12.364,400,False,6.9,movie,/ouqIPlczOt2fpr9KkJ5EndSnSQp.jpg,False,"Francesco Dellamorte es el cuidador del cementerio de Buffalora, un pueblo del norte de Italia. Dellamorte vive una vida solitaria apartado del mundo; su único amigo es Gnaghi, un pequeño, feo, lisiado y mudo compañero con el que comparte su ronda diaria por el cementerio. Desde hace algún tiempo, los muertos enterrados en el cementerio de Buffalora reviven debido a una súbita y misteriosa epidemia. Dellamorte tendrá que impedir que los muertos invadan el mundo de los vivos, algo que el resto de los humanos piensa que es sólo parte de su imaginación.",1996-04-26,"[27, 14, 35, 18]",DellaMorte DellAmore,it,Mi novia es un zombie,/hEhOPX1NCke6ky7930NqNXZYuu1.jpg,12.364,400,False,6.9,movie
160,40264,/m3RvsysFahSo2BI8aeywjYhzcn5.jpg,False,"'Vampires Suck' es una comedia sobre la ansiedad adolescente. Becca es una adolescente no vampiro que se debate entre dos chicos. Antes de que pueda elegir, Becca debe sortear a su padre, quien avergüenza a su hija por tratarla como si fuera una niña. Mientras tanto, los amigos de Becca deberán lidiar con sus propios problemas amorosos, chocando todos ellos en el baile de graduación. Parodia de la creciente moda de las películas vampíricas, tomando ""Crepúsculo"" como eje.",2010-08-18,"[27, 35]",Vampires Suck,en,Híncame el diente,/nawzkUvXFv5J0Lwjw1OLwZGXLSA.jpg,13.615,1102,False,4.2,movie,/m3RvsysFahSo2BI8aeywjYhzcn5.jpg,False,"'Vampires Suck' es una comedia sobre la ansiedad adolescente. Becca es una adolescente no vampiro que se debate entre dos chicos. Antes de que pueda elegir, Becca debe sortear a su padre, quien avergüenza a su hija por tratarla como si fuera una niña. Mientras tanto, los amigos de Becca deberán lidiar con sus propios problemas amorosos, chocando todos ellos en el baile de graduación. Parodia de la creciente moda de las películas vampíricas, tomando ""Crepúsculo"" como eje.",2010-08-18,"[27, 35]",Vampires Suck,en,Híncame el diente,/nawzkUvXFv5J0Lwjw1OLwZGXLSA.jpg,13.615,1102,False,4.2,movie
161,15762,/A3s2tQGNb6mhlr1hPZeE5F8IUwp.jpg,False,"Un peligroso organismo extraterrestre llega a la Tierra, se trata de unas babosas del espacio que se introducen por la boca, alojándose en el cerebro de la víctima y convirtiéndolos en auténticos zombies. Así, estas babosas alienígenas siembran el terror adolescente en esta producción de los ochenta que homenajea el cine de terror de serie B. Su leyenda reza: ""La buena noticia es que tus citas están aquí... la mala es... que están muertas"".",1986-08-21,"[27, 35, 878]",Night of the Creeps,en,El terror llama a su puerta,/i1fGLYO2nzkFazh58sgOT7ohosU.jpg,11.853,410,False,6.7,movie,/A3s2tQGNb6mhlr1hPZeE5F8IUwp.jpg,False,"Un peligroso organismo extraterrestre llega a la Tierra, se trata de unas babosas del espacio que se introducen por la boca, alojándose en el cerebro de la víctima y convirtiéndolos en auténticos zombies. Así, estas babosas alienígenas siembran el terror adolescente en esta producción de los ochenta que homenajea el cine de terror de serie B. Su leyenda reza: ""La buena noticia es que tus citas están aquí... la mala es... que están muertas"".",1986-08-21,"[27, 35, 878]",Night of the Creeps,en,El terror llama a su puerta,/i1fGLYO2nzkFazh58sgOT7ohosU.jpg,11.853,410,False,6.7,movie
162,165864,/7XUTA42MFXWoUNzdvCgs9PYwJrT.jpg,False,"Un par de hermanos combaten a una bruja que utiliza una droga especial de marihuana para atraer adolescentes a su casa en los suburbios, donde los devora para mantener su belleza y juventud.",2013-02-19,"[27, 35]",Hansel and Gretel Get Baked,en,Hansel y Gretel: La bruja del Bosque Negro,/2z4n91LX9jtg9VUW8JSeMFLP8A0.jpg,11.596,187,False,5.1,movie,/7XUTA42MFXWoUNzdvCgs9PYwJrT.jpg,False,"Un par de hermanos combaten a una bruja que utiliza una droga especial de marihuana para atraer adolescentes a su casa en los suburbios, donde los devora para mantener su belleza y juventud.",2013-02-19,"[27, 35]",Hansel and Gretel Get Baked,en,Hansel y Gretel: La bruja del Bosque Negro,/2z4n91LX9jtg9VUW8JSeMFLP8A0.jpg,11.596,187,False,5.1,movie
163,24929,/oiV6LE4kxfbWaWha7PWJW9xM25k.jpg,False,"Unos misteriosos barriles caen de un camión del ejército cerca de un cementerio abandonado de un pequeño pueblo, donde unos chicos los abren sin saber las consecuencias que ello concierne, pues su contenido despertará a los muertos.",1988-01-15,"[27, 35]",Return of the Living Dead Part II,en,La divertida noche de los zombies,/o8sHDEdPa9oxkGlHkXATXzNoniR.jpg,11.592,496,False,6.2,movie,/oiV6LE4kxfbWaWha7PWJW9xM25k.jpg,False,"Unos misteriosos barriles caen de un camión del ejército cerca de un cementerio abandonado de un pequeño pueblo, donde unos chicos los abren sin saber las consecuencias que ello concierne, pues su contenido despertará a los muertos.",1988-01-15,"[27, 35]",Return of the Living Dead Part II,en,La divertida noche de los zombies,/o8sHDEdPa9oxkGlHkXATXzNoniR.jpg,11.592,496,False,6.2,movie
164,23127,/yHxMxYyDuLfwiZs02hSjrxaJy2w.jpg,False,"El film narra la retorcida historia de El Superbeasto (voz de Tom Papa), una especie de antiguo luchador enmascarado con fuerza sobrenatural, quien en estos momentos se dedica a la producción/dirección como estrella del Beastoworld Enterprise, pero que cuando puede pasa el tiempo luchando contra el mal junto a su Super-Sexy hermana, Suzi X (voz de Sheri Moon Zombie). Basado en el cómic de Rob Zombie, se trata de un film de animación que fue lanzado directamente a DVD con la calificación R.",2009-09-12,"[16, 27, 28, 35]",The Haunted World of El Superbeasto,en,The Haunted World of El Superbeasto,/s3OkNCJMB5vKpU64d2ktQK58rBi.jpg,11.34,144,False,6.0,movie,/yHxMxYyDuLfwiZs02hSjrxaJy2w.jpg,False,"El film narra la retorcida historia de El Superbeasto (voz de Tom Papa), una especie de antiguo luchador enmascarado con fuerza sobrenatural, quien en estos momentos se dedica a la producción/dirección como estrella del Beastoworld Enterprise, pero que cuando puede pasa el tiempo luchando contra el mal junto a su Super-Sexy hermana, Suzi X (voz de Sheri Moon Zombie). Basado en el cómic de Rob Zombie, se trata de un film de animación que fue lanzado directamente a DVD con la calificación R.",2009-09-12,"[16, 27, 28, 35]",The Haunted World of El Superbeasto,en,The Haunted World of El Superbeasto,/s3OkNCJMB5vKpU64d2ktQK58rBi.jpg,11.34,144,False,6.0,movie
165,886083,/qzpeegVCMYp8lWVt4WY9S4zQ9Kp.jpg,False,"Una personalidad de Internet en desgracia intenta recuperar a sus seguidores transmitiendo en vivo una noche solo en una casa embrujada. Pero cuando accidentalmente hace enojar a un espíritu vengativo, su gran evento de regreso se convierte en una lucha en tiempo real por su vida.",2022-03-11,"[27, 35]",Deadstream,en,Deadstream,/2NrIzba4wHUYXJurKAMFs70Qcok.jpg,12.174,116,False,6.3,movie,/qzpeegVCMYp8lWVt4WY9S4zQ9Kp.jpg,False,"Una personalidad de Internet en desgracia intenta recuperar a sus seguidores transmitiendo en vivo una noche solo en una casa embrujada. Pero cuando accidentalmente hace enojar a un espíritu vengativo, su gran evento de regreso se convierte en una lucha en tiempo real por su vida.",2022-03-11,"[27, 35]",Deadstream,en,Deadstream,/2NrIzba4wHUYXJurKAMFs70Qcok.jpg,12.174,116,False,6.3,movie
166,41275,/lDbTpRHTRFWBK4j0FAWpE4M5WT2.jpg,False,"Un científico crea un arma letal al mutar a una enorme serpiente Pitón que escapa al momento de ser transportada, causando un gran daño a los habitantes de un pueblo.",2001-01-16,"[35, 27, 878]",Python,en,Python,/jJbUhrfncDTCJenKQBrC6ka1LVH.jpg,11.984,89,False,5.1,movie,/lDbTpRHTRFWBK4j0FAWpE4M5WT2.jpg,False,"Un científico crea un arma letal al mutar a una enorme serpiente Pitón que escapa al momento de ser transportada, causando un gran daño a los habitantes de un pueblo.",2001-01-16,"[35, 27, 878]",Python,en,Python,/jJbUhrfncDTCJenKQBrC6ka1LVH.jpg,11.984,89,False,5.1,movie
167,15742,/tDpOqvZrrpzcZnOGcr6QZU0nZdy.jpg,False,"Historia de tres generaciones de una familia establecida por casualidad en Europa del Este. La del abuelo, un hombre algo torpe que se convierte en capitán durante la segunda Guerra Mundial; la del padre, un deportista de alto nivel; y finalmente la del hijo, un taxidermista. Las tres contadas por el miembro más joven de la familia. El surrealismo y los hechos históricos se mezclan en su imaginación, creando así una especie de ""cuento de hadas realista"".",2009-08-14,"[18, 27, 35]",Taxidermia,hu,Taxidermia,/hfoZ9rFHh2FJQdFT0pSddDqLZ6x.jpg,9.303,258,False,6.6,movie,/tDpOqvZrrpzcZnOGcr6QZU0nZdy.jpg,False,"Historia de tres generaciones de una familia establecida por casualidad en Europa del Este. La del abuelo, un hombre algo torpe que se convierte en capitán durante la segunda Guerra Mundial; la del padre, un deportista de alto nivel; y finalmente la del hijo, un taxidermista. Las tres contadas por el miembro más joven de la familia. El surrealismo y los hechos históricos se mezclan en su imaginación, creando así una especie de ""cuento de hadas realista"".",2009-08-14,"[18, 27, 35]",Taxidermia,hu,Taxidermia,/hfoZ9rFHh2FJQdFT0pSddDqLZ6x.jpg,9.303,258,False,6.6,movie
168,374052,/kn0u65EVTpvrFOGp4fdaHKalw0B.jpg,False,"Una joven bruja está empeñada en encontrar el amor a base de conjuros y pócimas que le permitan seducir a cualquiera. Cuando por fin encuentra al hombre de sus sueños, su deseo se convierte en desesperación, en locura y luego en... Con un estilo visual que homenajea los thrillers en Technicolor de los sesenta, The Love Witch explora las fantasías femeninas y las consecuencias del narcisismo exacerbado.",2016-11-11,"[14, 10749, 27, 35]",The Love Witch,en,The Love Witch,/caOdCGw5ExDfNfbj6VWJJ979iVT.jpg,13.557,423,False,6.4,movie,/kn0u65EVTpvrFOGp4fdaHKalw0B.jpg,False,"Una joven bruja está empeñada en encontrar el amor a base de conjuros y pócimas que le permitan seducir a cualquiera. Cuando por fin encuentra al hombre de sus sueños, su deseo se convierte en desesperación, en locura y luego en... Con un estilo visual que homenajea los thrillers en Technicolor de los sesenta, The Love Witch explora las fantasías femeninas y las consecuencias del narcisismo exacerbado.",2016-11-11,"[14, 10749, 27, 35]",The Love Witch,en,The Love Witch,/caOdCGw5ExDfNfbj6VWJJ979iVT.jpg,13.557,423,False,6.4,movie
169,5680,/k3UaVqaernacRyKkvZd2NpqZdZJ.jpg,False,"Elvira, una presentadora de televisión de un programa de terror, viaja a Massachussets para recibir la herencia de su fallecida tía Morgana: una casa ruinosa, un perro y un libro de recetas. Poco después, encuentra una misteriosa carta...",1988-09-30,"[27, 35]","Elvira, Mistress of the Dark",en,"Elvira, la reina de las tinieblas",/4s5Dkt8XIDBq5rmBeV17GKfrg6s.jpg,15.8,421,False,6.5,movie,/k3UaVqaernacRyKkvZd2NpqZdZJ.jpg,False,"Elvira, una presentadora de televisión de un programa de terror, viaja a Massachussets para recibir la herencia de su fallecida tía Morgana: una casa ruinosa, un perro y un libro de recetas. Poco después, encuentra una misteriosa carta...",1988-09-30,"[27, 35]","Elvira, Mistress of the Dark",en,"Elvira, la reina de las tinieblas",/4s5Dkt8XIDBq5rmBeV17GKfrg6s.jpg,15.8,421,False,6.5,movie
170,9306,/hOJeQXve8W9rNRhdgC1WV3GQJyA.jpg,False,"Tras sobrevivir a un accidente de avión en el mar, el negociador de la ONU Edward Douglas (David Thewlis) es recogido en medio del mar y llevado a una misteriosa isla habitada por unos seres extraños y deformes que están a las órdenes de un siniestro médico, el Dr. Moreau (Marlon Brando).",1996-08-23,"[878, 27, 14, 18, 35]",The Island of Dr. Moreau,en,La isla del Dr. Moreau,/90xPBB5JQbNbET8IOfjpAPFYTRM.jpg,12.52,451,False,4.8,movie,/hOJeQXve8W9rNRhdgC1WV3GQJyA.jpg,False,"Tras sobrevivir a un accidente de avión en el mar, el negociador de la ONU Edward Douglas (David Thewlis) es recogido en medio del mar y llevado a una misteriosa isla habitada por unos seres extraños y deformes que están a las órdenes de un siniestro médico, el Dr. Moreau (Marlon Brando).",1996-08-23,"[878, 27, 14, 18, 35]",The Island of Dr. Moreau,en,La isla del Dr. Moreau,/90xPBB5JQbNbET8IOfjpAPFYTRM.jpg,12.52,451,False,4.8,movie
171,246741,/zMpZYL0lVgLCYyOVGekaZC0bUtv.jpg,False,"Viago, Deacon y Vladislav son tres vampiros que comparten piso en Nueva Zelanda. Hacen lo posible por adaptarse a la sociedad moderna: pagan el alquiler, se reparten las tareas domésticas e intentan que les inviten a entrar en los clubs. Una vida normal, salvo por una pequeña diferencia: son inmortales y tienen que alimentarse de sangre humana. Cuando su compañero del sótano, Petyr, convierte en vampiro a Nick, nuestros protagonistas deberán enseñarle como funciona todo en su recién estrenada vida eterna.",2015-02-13,"[35, 27]",What We Do in the Shadows,en,Lo que hacemos en las sombras,/k4AVaOboquMcd3zbFSSgCEbzabz.jpg,14.869,3114,False,7.6,movie,/zMpZYL0lVgLCYyOVGekaZC0bUtv.jpg,False,"Viago, Deacon y Vladislav son tres vampiros que comparten piso en Nueva Zelanda. Hacen lo posible por adaptarse a la sociedad moderna: pagan el alquiler, se reparten las tareas domésticas e intentan que les inviten a entrar en los clubs. Una vida normal, salvo por una pequeña diferencia: son inmortales y tienen que alimentarse de sangre humana. Cuando su compañero del sótano, Petyr, convierte en vampiro a Nick, nuestros protagonistas deberán enseñarle como funciona todo en su recién estrenada vida eterna.",2015-02-13,"[35, 27]",What We Do in the Shadows,en,Lo que hacemos en las sombras,/k4AVaOboquMcd3zbFSSgCEbzabz.jpg,14.869,3114,False,7.6,movie
172,323262,/kHxGhrihg65laH5sDt9d0w7Ly8e.jpg,False,"Esta antología de terror reúne una serie de relatos cortos, cada uno inspirado en una celebración distinta, entre la que encontramos Navidad, San Valentín o Pascua, pero todos con el punto en común de darle una vuelta escalofriantes a las tradiciones y el folclore.",2016-04-22,"[35, 27]",Holidays,en,Holidays,/j0WqwIfrrzDgvnEBXbzM41ulpWY.jpg,10.517,435,False,5.0,movie,/kHxGhrihg65laH5sDt9d0w7Ly8e.jpg,False,"Esta antología de terror reúne una serie de relatos cortos, cada uno inspirado en una celebración distinta, entre la que encontramos Navidad, San Valentín o Pascua, pero todos con el punto en común de darle una vuelta escalofriantes a las tradiciones y el folclore.",2016-04-22,"[35, 27]",Holidays,en,Holidays,/j0WqwIfrrzDgvnEBXbzM41ulpWY.jpg,10.517,435,False,5.0,movie
173,6488,/tGgg5ro9t9YdPZCjLa7j24nk1K1.jpg,False,Una pequeña población es atacada por una extraña variedad de araña extremadamente venenosa que ha sido transportada desde la selva amazónica hasta Estados Unidos. La araña se refugia en el granero de un joven médico que acaba de instalarse en el pueblo con su familia. El arácnido se reproduce y pronto comienza a morir gente en el pueblo. El médico decide investigar por su cuenta las causas de tan raras muertes.,1990-07-20,"[35, 27]",Arachnophobia,en,Aracnofobia,/w1PDaPJuW3D1TfSxesY7nGZZYS7.jpg,10.316,1181,False,6.4,movie,/tGgg5ro9t9YdPZCjLa7j24nk1K1.jpg,False,Una pequeña población es atacada por una extraña variedad de araña extremadamente venenosa que ha sido transportada desde la selva amazónica hasta Estados Unidos. La araña se refugia en el granero de un joven médico que acaba de instalarse en el pueblo con su familia. El arácnido se reproduce y pronto comienza a morir gente en el pueblo. El médico decide investigar por su cuenta las causas de tan raras muertes.,1990-07-20,"[35, 27]",Arachnophobia,en,Aracnofobia,/w1PDaPJuW3D1TfSxesY7nGZZYS7.jpg,10.316,1181,False,6.4,movie
174,1694,/zUwzx9mKVugyjYyTNzKhBscscT3.jpg,False,"Herbert West estudia en Europa métodos regenerativos junto a un conocido científico, que muere en extrañas circunstancias. Herbert viaja a EEUU, donde se matricula en la Miskatonic University. Allí continúa con sus experimentos, que tienen la intención de alcanzar la fórmula que permita reanimar los muertos. Su compañero de piso Dan y la novia de éste, Megan, se verán envueltos en el macabro proyecto.",1985-10-18,"[878, 35, 27]",Re-Animator,en,Re-Animator,/crHveywyqIiqzkUiQiwNuNJph5.jpg,13.751,1254,False,7.0,movie,/zUwzx9mKVugyjYyTNzKhBscscT3.jpg,False,"Herbert West estudia en Europa métodos regenerativos junto a un conocido científico, que muere en extrañas circunstancias. Herbert viaja a EEUU, donde se matricula en la Miskatonic University. Allí continúa con sus experimentos, que tienen la intención de alcanzar la fórmula que permita reanimar los muertos. Su compañero de piso Dan y la novia de éste, Megan, se verán envueltos en el macabro proyecto.",1985-10-18,"[878, 35, 27]",Re-Animator,en,Re-Animator,/crHveywyqIiqzkUiQiwNuNJph5.jpg,13.751,1254,False,7.0,movie
175,11908,/xRWRUZchxjttsNkGVZD2zGpihbJ.jpg,False,"Victor Crowley fue asesinado a hachazos por su padre y ahora, como fantasma, se dedica a acabar con los turistas que realizan excursiones por los lagos de Nueva Orleans.",2006-04-27,"[35, 27]",Hatchet,en,Hatchet,/vr86BT7sFQqD6NJYdh6uUSrEL9g.jpg,13.501,551,False,5.8,movie,/xRWRUZchxjttsNkGVZD2zGpihbJ.jpg,False,"Victor Crowley fue asesinado a hachazos por su padre y ahora, como fantasma, se dedica a acabar con los turistas que realizan excursiones por los lagos de Nueva Orleans.",2006-04-27,"[35, 27]",Hatchet,en,Hatchet,/vr86BT7sFQqD6NJYdh6uUSrEL9g.jpg,13.501,551,False,5.8,movie
176,92208,/8NU0H5YlQ4zM6deW8lvlln8D2Zw.jpg,False,"Los niños de Hansen están en un aprieto. Adam y su mejor amigo Duffy han conseguido algunas entradas para el concierto de Headless Horseman, y su hermana Chelsea tiene una cita con su soñador novio Peter. El único problema es que ambos están castigados. Chelsea y Adam harán lo que sea necesario para sacar a su madre Lynette de la casa, incluso si incluye una reunión casual con un hombre muy misterioso. Todo parece ir de acuerdo al plan hasta que su hermanito Taylor se da cuenta de que este extraño podría ser un vampiro.",2000-10-13,"[10770, 35, 10751, 14, 27]",Mom's Got a Date with a Vampire,en,Un Vampiro para Mamá,/oJe5xph6PxARGmEAYpuf06fFw45.jpg,14.978,104,False,5.7,movie,/8NU0H5YlQ4zM6deW8lvlln8D2Zw.jpg,False,"Los niños de Hansen están en un aprieto. Adam y su mejor amigo Duffy han conseguido algunas entradas para el concierto de Headless Horseman, y su hermana Chelsea tiene una cita con su soñador novio Peter. El único problema es que ambos están castigados. Chelsea y Adam harán lo que sea necesario para sacar a su madre Lynette de la casa, incluso si incluye una reunión casual con un hombre muy misterioso. Todo parece ir de acuerdo al plan hasta que su hermanito Taylor se da cuenta de que este extraño podría ser un vampiro.",2000-10-13,"[10770, 35, 10751, 14, 27]",Mom's Got a Date with a Vampire,en,Un Vampiro para Mamá,/oJe5xph6PxARGmEAYpuf06fFw45.jpg,14.978,104,False,5.7,movie
177,47519,/3QBiToMO1qicJ6TDq4uaD3vYsgo.jpg,False,"Un libro de los muertos medieval es descubierto en las catacumbas que hay bajo un club de strip-tease de un pequeño pueblo. Cuando una de las desesperadas strippers pone en pie un ejército de no-muertos, el resto de ellas debe patear unos cuantos culos zombis para salvar el mundo.",2010-07-16,"[28, 27, 35]",巨乳ドラゴン 温泉ゾンビVSストリッパー5,ja,Big Tits Zombie,/nze990j4KZAeeF5xp6QR5I7Idz0.jpg,10.217,33,False,5.1,movie,/3QBiToMO1qicJ6TDq4uaD3vYsgo.jpg,False,"Un libro de los muertos medieval es descubierto en las catacumbas que hay bajo un club de strip-tease de un pequeño pueblo. Cuando una de las desesperadas strippers pone en pie un ejército de no-muertos, el resto de ellas debe patear unos cuantos culos zombis para salvar el mundo.",2010-07-16,"[28, 27, 35]",巨乳ドラゴン 温泉ゾンビVSストリッパー5,ja,Big Tits Zombie,/nze990j4KZAeeF5xp6QR5I7Idz0.jpg,10.217,33,False,5.1,movie
178,31578,/vZrHLfxKiJ6NgPn0Xi0mJ4HMWWy.jpg,False,"Película dividida en tres historias diferentes: un hombre que se está quedando calvo acude a una extraña clínica especializada en el tratamiento de la alopecia; una chica que trabaja en una gasolinera se entera de que hay un asesino suelto por la zona, y un jugador de béisbol sufre un accidente y le trasplantan un ojo que parece ser el de un asesino en serie.",1993-08-08,"[10770, 27, 35, 878]",Body Bags,en,Bolsa de cadáveres,/40a2z21BPfsNjDJbhZ0WshZFDF.jpg,11.448,264,False,6.2,movie,/vZrHLfxKiJ6NgPn0Xi0mJ4HMWWy.jpg,False,"Película dividida en tres historias diferentes: un hombre que se está quedando calvo acude a una extraña clínica especializada en el tratamiento de la alopecia; una chica que trabaja en una gasolinera se entera de que hay un asesino suelto por la zona, y un jugador de béisbol sufre un accidente y le trasplantan un ojo que parece ser el de un asesino en serie.",1993-08-08,"[10770, 27, 35, 878]",Body Bags,en,Bolsa de cadáveres,/40a2z21BPfsNjDJbhZ0WshZFDF.jpg,11.448,264,False,6.2,movie
179,749645,/mTMCGD2oKhJXrmLpvy4sCwdL84m.jpg,False,"Un agente de Hollywood casado recibe una misteriosa carta para un encuentro sexual anónimo y se ve envuelto en un mundo siniestro de mentiras, infidelidad y datos digitales.",2021-11-05,"[53, 27, 35]",The Beta Test,en,The Beta Test,/6IDpbCTxUrOlz61HJScgWXCnJxl.jpg,12.223,165,False,6.2,movie,/mTMCGD2oKhJXrmLpvy4sCwdL84m.jpg,False,"Un agente de Hollywood casado recibe una misteriosa carta para un encuentro sexual anónimo y se ve envuelto en un mundo siniestro de mentiras, infidelidad y datos digitales.",2021-11-05,"[53, 27, 35]",The Beta Test,en,The Beta Test,/6IDpbCTxUrOlz61HJScgWXCnJxl.jpg,12.223,165,False,6.2,movie
