,id,poster_path,adult,overview,release_date,genre_ids,original_title,original_language,title,backdrop_path,popularity,vote_count,video,vote_average,media_type,poster_path_drop,adult_drop,overview_drop,release_date_drop,genre_ids_drop,original_title_drop,original_language_drop,title_drop,backdrop_path_drop,popularity_drop,vote_count_drop,video_drop,vote_average_drop,media_type_drop
327,317981,/ymDJQsmDSgQ4IGZAxW4aR0WpVAr.jpg,False,"Evan es un empleado obediente y sobrecargado de trabajo, atrapado en una empresa que le explota, al igual que a su novia Amanda y a su holgazán mejor amigo Tim. El frágil mundo de Evan termina de desmoronarse cuando su jefe, Ted, le concede su ansiado ascenso a su némesis en la empresa, Max. Pero todo eso no será nada comparado con el secreto que está a punto de descubrir, que pondrá su vida y la de sus compañeros en peligro.",2015-09-04,"[35, 27]",Bloodsucking Bastards,en,Bloodsucking Bastards,/sQmmdVLzY0eVUSSZikvnUSRKLi8.jpg,9.251,151,False,5.5,movie,/ymDJQsmDSgQ4IGZAxW4aR0WpVAr.jpg,False,"Evan es un empleado obediente y sobrecargado de trabajo, atrapado en una empresa que le explota, al igual que a su novia Amanda y a su holgazán mejor amigo Tim. El frágil mundo de Evan termina de desmoronarse cuando su jefe, Ted, le concede su ansiado ascenso a su némesis en la empresa, Max. Pero todo eso no será nada comparado con el secreto que está a punto de descubrir, que pondrá su vida y la de sus compañeros en peligro.",2015-09-04,"[35, 27]",Bloodsucking Bastards,en,Bloodsucking Bastards,/sQmmdVLzY0eVUSSZikvnUSRKLi8.jpg,9.251,151,False,5.5,movie
328,28498,/sGNEDM8h9ArDQgd5r7iCXzHKsWj.jpg,False,"Edward Lionheart (Vincent Price), prestigioso actor de teatro inglés, especializado en los personajes de Shakespeare, se siente muy humillado, cuando el Círculo de Críticos de Londres se niega a concederle un prestigioso galardón. Lleno de ira, planea meticulosamente una insólita venganza: eliminar, uno a uno, a todos los críticos que despreciaron su talento, eligiendo en cada caso un tipo distinto de muerte, todas ellas inspiradas en las obras de Shakespeare.",1973-04-05,"[35, 27]",Theatre of Blood,en,"Matar o no matar, éste es el problema",/1oz3oSYuOGV9VRziYNC7NnpDLXM.jpg,6.04,178,False,6.8,movie,/sGNEDM8h9ArDQgd5r7iCXzHKsWj.jpg,False,"Edward Lionheart (Vincent Price), prestigioso actor de teatro inglés, especializado en los personajes de Shakespeare, se siente muy humillado, cuando el Círculo de Críticos de Londres se niega a concederle un prestigioso galardón. Lleno de ira, planea meticulosamente una insólita venganza: eliminar, uno a uno, a todos los críticos que despreciaron su talento, eligiendo en cada caso un tipo distinto de muerte, todas ellas inspiradas en las obras de Shakespeare.",1973-04-05,"[35, 27]",Theatre of Blood,en,"Matar o no matar, éste es el problema",/1oz3oSYuOGV9VRziYNC7NnpDLXM.jpg,6.04,178,False,6.8,movie
329,9847,/ffdwEch96j7I2MhSC23c5gihUL6.jpg,False,Un asesino en serie obsesionado con Ronald Reagan persigue a una banda de hippies que van al bosque de Redwood a un concierto que dura un fin de semana...,2006-04-20,"[27, 35]",The Tripper,en,El republicano,/2EnCif25yjNStrXUIoaoBQYq5ka.jpg,8.521,91,False,4.8,movie,/ffdwEch96j7I2MhSC23c5gihUL6.jpg,False,Un asesino en serie obsesionado con Ronald Reagan persigue a una banda de hippies que van al bosque de Redwood a un concierto que dura un fin de semana...,2006-04-20,"[27, 35]",The Tripper,en,El republicano,/2EnCif25yjNStrXUIoaoBQYq5ka.jpg,8.521,91,False,4.8,movie
330,541099,/6DTcWoo8wWl2f2YPp21hfGAAD7O.jpg,False,"DeadTectives está lejos de ser el mejor programa de televisión, de hecho, la cadena amenaza con cancelarlo. La tiranía de la audiencia hará que el equipo de DeadTectives viaje a México para adentrarse en la casa más encantada del país y fingir ante la cámara y con la ayuda de FX que han visto fantasmas. El problema es que unas presencias comienzan a manifestarse… y no parecen fruto de ningún trucaje.",2019-07-18,"[35, 27]",DeadTectives,en,DeadTectives,/aA0fyft9c8MsmFfH9HhTxemewGx.jpg,6.879,61,False,6.2,movie,/6DTcWoo8wWl2f2YPp21hfGAAD7O.jpg,False,"DeadTectives está lejos de ser el mejor programa de televisión, de hecho, la cadena amenaza con cancelarlo. La tiranía de la audiencia hará que el equipo de DeadTectives viaje a México para adentrarse en la casa más encantada del país y fingir ante la cámara y con la ayuda de FX que han visto fantasmas. El problema es que unas presencias comienzan a manifestarse… y no parecen fruto de ningún trucaje.",2019-07-18,"[35, 27]",DeadTectives,en,DeadTectives,/aA0fyft9c8MsmFfH9HhTxemewGx.jpg,6.879,61,False,6.2,movie
331,24935,/lPm1ybrGkWPfoyveWprXbT1nhLu.jpg,False,"Un grupo de los adolescentes quiénes, en una tentativa de rescatar a un amigo de una mala situación, terminan por liberar una multitud de zombis sedientos de sangre.",2005-10-15,"[27, 35, 28]",Return of the Living Dead: Necropolis,en,El regreso de los muertos vivientes: Necrópolis,/acGljFlkrm40j64hozgj9arOmeb.jpg,9.537,204,False,5.4,movie,/lPm1ybrGkWPfoyveWprXbT1nhLu.jpg,False,"Un grupo de los adolescentes quiénes, en una tentativa de rescatar a un amigo de una mala situación, terminan por liberar una multitud de zombis sedientos de sangre.",2005-10-15,"[27, 35, 28]",Return of the Living Dead: Necropolis,en,El regreso de los muertos vivientes: Necrópolis,/acGljFlkrm40j64hozgj9arOmeb.jpg,9.537,204,False,5.4,movie
332,720407,/HizqO0Htv6e68pWu0gzsoDthXq.jpg,False,Seis actores deciden grabar su propia película de terror cuando la serie en la que todos participan está al borde de la cancelación. En el proceso despiertan a un espíritu maligno con una notable afinidad por la violencia.,2021-06-12,"[27, 35]",Untitled Horror Movie,en,Untitled Horror Movie,/75mjiGG6ZJdibckg3gfoTrytDKG.jpg,9.581,34,False,4.1,movie,/HizqO0Htv6e68pWu0gzsoDthXq.jpg,False,Seis actores deciden grabar su propia película de terror cuando la serie en la que todos participan está al borde de la cancelación. En el proceso despiertan a un espíritu maligno con una notable afinidad por la violencia.,2021-06-12,"[27, 35]",Untitled Horror Movie,en,Untitled Horror Movie,/75mjiGG6ZJdibckg3gfoTrytDKG.jpg,9.581,34,False,4.1,movie
333,2182,/trbJ7xnbM66ive5qNEVTbfJQjZo.jpg,False,"Los tomates, hartos de tantos años de acabar como sofrito o bloody mary, están cobrando vida y están asesinando a los humanos. Se sospecha que este hecho está provocado por un pesticida creado por un loco que quiere el control del mundo. Sólo un agente especial y su osado comando lucharán para detener la invasión de tomates que se avecina y que amenaza a la humanidad con el exterminio.",1978-10-01,"[35, 27, 878]",Attack of the Killer Tomatoes!,en,El ataque de los tomates asesinos,/n8jSLMc8zT2p1rELAUyRCc3VN7B.jpg,10.034,243,False,5.0,movie,/trbJ7xnbM66ive5qNEVTbfJQjZo.jpg,False,"Los tomates, hartos de tantos años de acabar como sofrito o bloody mary, están cobrando vida y están asesinando a los humanos. Se sospecha que este hecho está provocado por un pesticida creado por un loco que quiere el control del mundo. Sólo un agente especial y su osado comando lucharán para detener la invasión de tomates que se avecina y que amenaza a la humanidad con el exterminio.",1978-10-01,"[35, 27, 878]",Attack of the Killer Tomatoes!,en,El ataque de los tomates asesinos,/n8jSLMc8zT2p1rELAUyRCc3VN7B.jpg,10.034,243,False,5.0,movie
334,29095,/48RXt1Zu8iNL0mgCojydmqBsjsC.jpg,False,"Hay un nuevo museo en la ciudad, un museo de cera. El propietario, tratándose de algo novedoso en el lugar, invita a varios grupos de adolescentes para que entren a las sesiones de horas más intempestivas, eso sí, sin pagar. En el interior, las figuras de cera reproducen macabras escenas de crímenes y los más terroríficos personajes de terror. ¿Pero son simplemente seres inertes? La respuesta es no, ya que cobran vida y nutrirán su hambre de matar con los inocentes visitantes, que se convertirán en inesperados personajes de las historias que allí se representan.",1988-06-17,"[27, 35]",Waxwork,en,Waxwork: Museo de cera,/x0sEJCg6UsLoGs8r9b4l8rp1oxe.jpg,8.783,233,False,6.1,movie,/48RXt1Zu8iNL0mgCojydmqBsjsC.jpg,False,"Hay un nuevo museo en la ciudad, un museo de cera. El propietario, tratándose de algo novedoso en el lugar, invita a varios grupos de adolescentes para que entren a las sesiones de horas más intempestivas, eso sí, sin pagar. En el interior, las figuras de cera reproducen macabras escenas de crímenes y los más terroríficos personajes de terror. ¿Pero son simplemente seres inertes? La respuesta es no, ya que cobran vida y nutrirán su hambre de matar con los inocentes visitantes, que se convertirán en inesperados personajes de las historias que allí se representan.",1988-06-17,"[27, 35]",Waxwork,en,Waxwork: Museo de cera,/x0sEJCg6UsLoGs8r9b4l8rp1oxe.jpg,8.783,233,False,6.1,movie
335,13742,/yKQVAUKRNAdAXPwsp0StPctpVIa.jpg,False,"Un grupo de jóvenes, tras salir de una discoteca, se encuentran accidentalmente con un pastor que se está preparando para un noche de exorcismo satánico.",2006-12-26,"[35, 27, 53]",Sheitan,fr,Sheitan,/8RblQZM2gy2K8AQ2RXP7UzEW8jW.jpg,8.534,303,False,5.7,movie,/yKQVAUKRNAdAXPwsp0StPctpVIa.jpg,False,"Un grupo de jóvenes, tras salir de una discoteca, se encuentran accidentalmente con un pastor que se está preparando para un noche de exorcismo satánico.",2006-12-26,"[35, 27, 53]",Sheitan,fr,Sheitan,/8RblQZM2gy2K8AQ2RXP7UzEW8jW.jpg,8.534,303,False,5.7,movie
336,18498,/qa8vCCxdHaPe79mbVkojKhDVzDM.jpg,False,"Jonathan Graves hereda la mansión de su tío, el famoso satanista Malcolm Graves. En la fiesta de inauguración de su nueva casa, decide inspirarse en una serie de rituales satánicos para dar una sorpresa a los presentes, pero algo terrible sucede... Conjura a una horda de pequeños ""Goblins"" llamados Ghoulies. Estos pequeños y malévolos espíritus intentarán por todos los medios crear un ritual, en el cual sacrificarían a todos los presentes, para que así se abran las puertas del infierno y escape el mismísimo Diablo... Considerados como una copia cutre de ""Gremlins"" de serie B (apenas costó 1 millón de dólares), obtuvo sin embargo un considerable éxito de taquilla, principalmente en el -entonces emergente- mercado de video, siendo tan rentable (recaudó sólo en USA 35 millones de dólares) que propició que se hicieran varias secuelas.",1985-01-18,"[35, 27, 14]",Ghoulies,en,Ghoulies,/f01AbhKF4GSAxUxxBnXqk1012Ga.jpg,5.782,202,False,4.8,movie,/qa8vCCxdHaPe79mbVkojKhDVzDM.jpg,False,"Jonathan Graves hereda la mansión de su tío, el famoso satanista Malcolm Graves. En la fiesta de inauguración de su nueva casa, decide inspirarse en una serie de rituales satánicos para dar una sorpresa a los presentes, pero algo terrible sucede... Conjura a una horda de pequeños ""Goblins"" llamados Ghoulies. Estos pequeños y malévolos espíritus intentarán por todos los medios crear un ritual, en el cual sacrificarían a todos los presentes, para que así se abran las puertas del infierno y escape el mismísimo Diablo... Considerados como una copia cutre de ""Gremlins"" de serie B (apenas costó 1 millón de dólares), obtuvo sin embargo un considerable éxito de taquilla, principalmente en el -entonces emergente- mercado de video, siendo tan rentable (recaudó sólo en USA 35 millones de dólares) que propició que se hicieran varias secuelas.",1985-01-18,"[35, 27, 14]",Ghoulies,en,Ghoulies,/f01AbhKF4GSAxUxxBnXqk1012Ga.jpg,5.782,202,False,4.8,movie
337,520905,/lgMRfXN5mX0z6zBuQ5MNVvWBOHW.jpg,False,"Tras perder su trabajo y terminar con su relación disfuncional, Olive (Crew) decide abandonar la ciudad para pasar unos días de tranquilidad en el campo. Para ello alquila una casa rural un tanto excéntrica y muy ornamentada de un señor que se hace llamar Harvey (Patrick), un viudo que trata de ocultar por todos los medios sus tendencias psicópatas.",2019-03-10,"[27, 53, 35]",Tone-Deaf,en,Insanidad - La lucha es real,/A1D7ZgiSwirHbniB5ipkqnI0oqq.jpg,7.302,67,False,5.4,movie,/lgMRfXN5mX0z6zBuQ5MNVvWBOHW.jpg,False,"Tras perder su trabajo y terminar con su relación disfuncional, Olive (Crew) decide abandonar la ciudad para pasar unos días de tranquilidad en el campo. Para ello alquila una casa rural un tanto excéntrica y muy ornamentada de un señor que se hace llamar Harvey (Patrick), un viudo que trata de ocultar por todos los medios sus tendencias psicópatas.",2019-03-10,"[27, 53, 35]",Tone-Deaf,en,Insanidad - La lucha es real,/A1D7ZgiSwirHbniB5ipkqnI0oqq.jpg,7.302,67,False,5.4,movie
338,27814,/nNJbQXlut92RIpcnPyoICzdJvJs.jpg,False,"Brian (Rick Hearst) es un tipo que vive con su hermano en un apartamento, cuando un día un extraño parásito con forma de pene y llamado Aylmer, se le aparece y le inyecta un alucinógeno líquido en el cerebro... Pero Aylmer le pide a Brian algo de alimento a cambio. Y lamentablemente Aylmer se alimenta de cerebros...",1988-04-15,"[27, 35]",Brain Damage,en,Brain Damage,/75MfI7JslB6p76YRBAXku5IVJb1.jpg,6.277,210,False,6.7,movie,/nNJbQXlut92RIpcnPyoICzdJvJs.jpg,False,"Brian (Rick Hearst) es un tipo que vive con su hermano en un apartamento, cuando un día un extraño parásito con forma de pene y llamado Aylmer, se le aparece y le inyecta un alucinógeno líquido en el cerebro... Pero Aylmer le pide a Brian algo de alimento a cambio. Y lamentablemente Aylmer se alimenta de cerebros...",1988-04-15,"[27, 35]",Brain Damage,en,Brain Damage,/75MfI7JslB6p76YRBAXku5IVJb1.jpg,6.277,210,False,6.7,movie
339,582883,/eML7PB0rMinQ9JG5mwEVXxv6eOp.jpg,False,"Georges tiene 44 años, y su chaqueta es de piel de ciervo. Es más, su cazadora le habla. Y Georges está dispuesto a hacer lo que sea por esta preciada pieza de ropa.",2020-03-20,"[35, 27]",Le Daim,fr,La chaqueta de piel de ciervo,/bUxoCldj0V9Y2bgQuUSFbSjKEWw.jpg,9.282,578,False,6.4,movie,/eML7PB0rMinQ9JG5mwEVXxv6eOp.jpg,False,"Georges tiene 44 años, y su chaqueta es de piel de ciervo. Es más, su cazadora le habla. Y Georges está dispuesto a hacer lo que sea por esta preciada pieza de ropa.",2020-03-20,"[35, 27]",Le Daim,fr,La chaqueta de piel de ciervo,/bUxoCldj0V9Y2bgQuUSFbSjKEWw.jpg,9.282,578,False,6.4,movie
340,343284,/tM2cjGghcFX0tYrHsIXGxEPI3uz.jpg,False,"Tras una prolongada noche de juerga junto a sus amigas, la encantadoramente torpe Deb despierta en el apartamento del tio más atractivo de Portland. Ella está encantada, pero no logra recordar cómo demonios llegó hasta allí. Por su parte, Ryan (el tipo atractivo), tan solo sabe que fue un error e invita a la chica a que abandone su casa… donde se está produciendo un apocalipsis zombi. Ahora, lo que tenía que ser un simple paseo de la vergüenza, se convierte en una lucha por la supervivencia, mientras descubren que la única cosa más aterradora que confiarle a alguien tu vida… es confiarle tu corazón.",2015-10-08,"[35, 27]",Night of the Living Deb,en,Deb contra los zombies,/ziupKeRs39HJf0m6V9F4vPxxCuP.jpg,7.775,122,False,5.3,movie,/tM2cjGghcFX0tYrHsIXGxEPI3uz.jpg,False,"Tras una prolongada noche de juerga junto a sus amigas, la encantadoramente torpe Deb despierta en el apartamento del tio más atractivo de Portland. Ella está encantada, pero no logra recordar cómo demonios llegó hasta allí. Por su parte, Ryan (el tipo atractivo), tan solo sabe que fue un error e invita a la chica a que abandone su casa… donde se está produciendo un apocalipsis zombi. Ahora, lo que tenía que ser un simple paseo de la vergüenza, se convierte en una lucha por la supervivencia, mientras descubren que la única cosa más aterradora que confiarle a alguien tu vida… es confiarle tu corazón.",2015-10-08,"[35, 27]",Night of the Living Deb,en,Deb contra los zombies,/ziupKeRs39HJf0m6V9F4vPxxCuP.jpg,7.775,122,False,5.3,movie
341,628446,/zRA71SDccp0VJicyeOdC070LSxA.jpg,False,"Francesca siempre fue un imán para atraer a gente extraña. Cuando uno de sus acosadores aparece un día muerto, ella trata de buscar consuelo en su mejor amigo, Maxi. Mientras tanto, su abuelo, un Rabbi caído en desgracia, encuentra por casualidad un sillón reclinable que esconde un dybuk en su interior. Jack y su compañera vudú tratan de averiguar a quién perteneció el sillón mientras exploran las habilidades sobrenaturales de éste para comunicarse con el otro mundo. Por desgracia para ellos, el sillón comienza a sentir algo por Francesca y, antes de que puedan darse cuenta, comienza a cometer crímenes de pasión por ella.",2019-10-28,"[35, 27]",Killer Sofa,en,Killer Sofa,/51O1TIrH4JYjfjZEn4Cb42SYEGy.jpg,9.102,94,False,4.8,movie,/zRA71SDccp0VJicyeOdC070LSxA.jpg,False,"Francesca siempre fue un imán para atraer a gente extraña. Cuando uno de sus acosadores aparece un día muerto, ella trata de buscar consuelo en su mejor amigo, Maxi. Mientras tanto, su abuelo, un Rabbi caído en desgracia, encuentra por casualidad un sillón reclinable que esconde un dybuk en su interior. Jack y su compañera vudú tratan de averiguar a quién perteneció el sillón mientras exploran las habilidades sobrenaturales de éste para comunicarse con el otro mundo. Por desgracia para ellos, el sillón comienza a sentir algo por Francesca y, antes de que puedan darse cuenta, comienza a cometer crímenes de pasión por ella.",2019-10-28,"[35, 27]",Killer Sofa,en,Killer Sofa,/51O1TIrH4JYjfjZEn4Cb42SYEGy.jpg,9.102,94,False,4.8,movie
342,35626,/p6V97pjGwN0fENR6mlBeUoAT73z.jpg,False,"Ya pasaron mas de 20 años desde la masacre ocurrida en el campamento Arawak. Angela Baker la psicopata causante de tantos y tan despiadados crimenes desaparecio. Ahora, se a reabierto un nuevo campamento no muy lejos de donde sucedieron los crimenes, y ahora... Angela ha regresado!",2008-11-04,"[9648, 27, 35]",Return to Sleepaway Camp,en,Campamento sangriento: el regreso,/a5o1VxHC6urCKWE620YFgYneV7j.jpg,7.518,290,False,6.0,movie,/p6V97pjGwN0fENR6mlBeUoAT73z.jpg,False,"Ya pasaron mas de 20 años desde la masacre ocurrida en el campamento Arawak. Angela Baker la psicopata causante de tantos y tan despiadados crimenes desaparecio. Ahora, se a reabierto un nuevo campamento no muy lejos de donde sucedieron los crimenes, y ahora... Angela ha regresado!",2008-11-04,"[9648, 27, 35]",Return to Sleepaway Camp,en,Campamento sangriento: el regreso,/a5o1VxHC6urCKWE620YFgYneV7j.jpg,7.518,290,False,6.0,movie
343,583116,/si4whlsGDBrjp7fRTJLvMsFZRVr.jpg,False,"Cuando el exitoso autor Carl Black traslada a su familia a la casa de su infancia, debe unirse con vecinos extraños para luchar con un proxeneta, que puede ser o no un vampiro real.",2021-06-11,"[35, 27]",The House Next Door: Meet the Blacks 2,en,The House Next Door: Meet the Blacks 2,/uzCgwCC6jW7vlpaOCWZCkUbqFWR.jpg,8.87,36,False,5.7,movie,/si4whlsGDBrjp7fRTJLvMsFZRVr.jpg,False,"Cuando el exitoso autor Carl Black traslada a su familia a la casa de su infancia, debe unirse con vecinos extraños para luchar con un proxeneta, que puede ser o no un vampiro real.",2021-06-11,"[35, 27]",The House Next Door: Meet the Blacks 2,en,The House Next Door: Meet the Blacks 2,/uzCgwCC6jW7vlpaOCWZCkUbqFWR.jpg,8.87,36,False,5.7,movie
344,15135,/9osHRGHGGoH6n5LKPMthPvJrB1Z.jpg,False,"Inmediatamente después de los acontecimientos de la secuela anterior, los supervivientes son salvados por el profeta misterioso, ""Short Bus Gus"", quien aparentemente tiene la capacidad de controlar a las bestias. Él los conduce por las alcantarillas hasta la gran ciudad. A lo largo del camino, consiguen la ayuda del experto en kárate, Jean-Claude Seagal y aprenden que las bestias provienen de un lugar llamado ""La Colmena"". Tras conocer este secreto, deciden aguantar y destruir a las bestias de una vez por todas.",2009-02-17,"[27, 28, 35, 53]",Feast III: The Happy Finish,en,Feast III: Atrapados III,/r2N3uY8C4aDeggY9wvRSdV1UKIl.jpg,5.733,99,False,4.8,movie,/9osHRGHGGoH6n5LKPMthPvJrB1Z.jpg,False,"Inmediatamente después de los acontecimientos de la secuela anterior, los supervivientes son salvados por el profeta misterioso, ""Short Bus Gus"", quien aparentemente tiene la capacidad de controlar a las bestias. Él los conduce por las alcantarillas hasta la gran ciudad. A lo largo del camino, consiguen la ayuda del experto en kárate, Jean-Claude Seagal y aprenden que las bestias provienen de un lugar llamado ""La Colmena"". Tras conocer este secreto, deciden aguantar y destruir a las bestias de una vez por todas.",2009-02-17,"[27, 28, 35, 53]",Feast III: The Happy Finish,en,Feast III: Atrapados III,/r2N3uY8C4aDeggY9wvRSdV1UKIl.jpg,5.733,99,False,4.8,movie
345,139715,/tf2baOEkFodZ5NYXMfb7gxcZgV.jpg,False,"Un grupo de excéntricos estudiantes de secundaria se encuentran atrapados en el aula de castigo cuando sus compañeros se convierten en una horda de zombis hambrientos. Un film en el que ""Shaun of the Dead"" se encuentra con ""The Breakfast Club""",2012-04-27,"[35, 27]",Detention of the Dead,en,Escuela de zombies,/xXeJA5T6kizxi5Goimo6S1jjL5m.jpg,6.007,75,False,4.9,movie,/tf2baOEkFodZ5NYXMfb7gxcZgV.jpg,False,"Un grupo de excéntricos estudiantes de secundaria se encuentran atrapados en el aula de castigo cuando sus compañeros se convierten en una horda de zombis hambrientos. Un film en el que ""Shaun of the Dead"" se encuentra con ""The Breakfast Club""",2012-04-27,"[35, 27]",Detention of the Dead,en,Escuela de zombies,/xXeJA5T6kizxi5Goimo6S1jjL5m.jpg,6.007,75,False,4.9,movie
346,10722,/e6Ogfx9HGvYFZ35fkb7k6fI5XzG.jpg,False,"Un sacerdote cree haber encontrado el mensaje secreto del Apocalipsis según San Juan: El Anticristo nacerá el 25 de diciembre de 1995 en Madrid. Para detener este nacimiento satánico, el cura se une a un joven aficionado al death metal, José María, intentando por todos los medios descubrir en qué parte de Madrid tendrá lugar el apocalíptico evento. Con la ayuda del profesor Cavan, que presenta un programa de televisión sobre el mundo esotérico y sobrenatural, el cura y José Mari invocan al diablo en una extraña ceremonia.",1998-12-23,"[28, 35, 27, 80, 14]",El día de la bestia,es,El día de la bestia,/7WBNrwjHrt3YTIbn5vWAJLf9yKD.jpg,11.698,451,False,7.3,movie,/e6Ogfx9HGvYFZ35fkb7k6fI5XzG.jpg,False,"Un sacerdote cree haber encontrado el mensaje secreto del Apocalipsis según San Juan: El Anticristo nacerá el 25 de diciembre de 1995 en Madrid. Para detener este nacimiento satánico, el cura se une a un joven aficionado al death metal, José María, intentando por todos los medios descubrir en qué parte de Madrid tendrá lugar el apocalíptico evento. Con la ayuda del profesor Cavan, que presenta un programa de televisión sobre el mundo esotérico y sobrenatural, el cura y José Mari invocan al diablo en una extraña ceremonia.",1998-12-23,"[28, 35, 27, 80, 14]",El día de la bestia,es,El día de la bestia,/7WBNrwjHrt3YTIbn5vWAJLf9yKD.jpg,11.698,451,False,7.3,movie
347,684420,/o6IuBgOC3e4dV72CSEYEVJiivLp.jpg,False,"¡Un gobierno dormido al volante! ¡Los ricos se encogen de hombros! ¡Y un virus que hace que sus víctimas se levanten y maten! Las personas que ellos matan... se levantan y matan. Film de bajo presupuesto rodado por Charles Band en apenas dos días para aprovechar la situación de la pandemia del COVID. De sus 60 minutos de duración, más de dos tercios pertenecen a metraje reciclado de otros films tales como ""Hell of the Living Dead"" (1980) o ""Zombies Vs. Strippers"" (2012) con un redoblaje para añadir contexto.",2020-04-10,"[27, 35]",Corona Zombies,en,Corona Zombies,/2Ej4c6N9ik4ggASyp6A8QWBjOlj.jpg,7.669,30,False,4.6,movie,/o6IuBgOC3e4dV72CSEYEVJiivLp.jpg,False,"¡Un gobierno dormido al volante! ¡Los ricos se encogen de hombros! ¡Y un virus que hace que sus víctimas se levanten y maten! Las personas que ellos matan... se levantan y matan. Film de bajo presupuesto rodado por Charles Band en apenas dos días para aprovechar la situación de la pandemia del COVID. De sus 60 minutos de duración, más de dos tercios pertenecen a metraje reciclado de otros films tales como ""Hell of the Living Dead"" (1980) o ""Zombies Vs. Strippers"" (2012) con un redoblaje para añadir contexto.",2020-04-10,"[27, 35]",Corona Zombies,en,Corona Zombies,/2Ej4c6N9ik4ggASyp6A8QWBjOlj.jpg,7.669,30,False,4.6,movie
348,10894,/oFXhJYTax1cnNtgvLdKlXuYiWPV.jpg,False,"Desde que era una niña, May ya era diferente. Todo lo que ella quería era ser aceptada por los demás, pero únicamente obtenía rechazos. Ya adolescente se muda a Los Angeles donde trabaja en un centro veterinario. Tiene una aventura romántica con Adam, un joven realizador, y luego con Polly, la recepcionista del hospital. Pero cuando sus relaciones fallan se siente fustrada. Y cuando May se siente fustrada, se vuelve violenta, muy violenta.",2003-06-03,"[35, 18, 27]",May,en,"May, ¿quieres ser mi amigo?",/j6Xhegu5hlTx6Q1bHYH9w6mAxA.jpg,8.999,502,False,6.5,movie,/oFXhJYTax1cnNtgvLdKlXuYiWPV.jpg,False,"Desde que era una niña, May ya era diferente. Todo lo que ella quería era ser aceptada por los demás, pero únicamente obtenía rechazos. Ya adolescente se muda a Los Angeles donde trabaja en un centro veterinario. Tiene una aventura romántica con Adam, un joven realizador, y luego con Polly, la recepcionista del hospital. Pero cuando sus relaciones fallan se siente fustrada. Y cuando May se siente fustrada, se vuelve violenta, muy violenta.",2003-06-03,"[35, 18, 27]",May,en,"May, ¿quieres ser mi amigo?",/j6Xhegu5hlTx6Q1bHYH9w6mAxA.jpg,8.999,502,False,6.5,movie
